1|AAAAAAAABAAAAAAA|1998-01-01|||2450952|NY Metro|large|135|76815|8AM-4PM|Bob Belcher|6|More than other authori|Shared others could not count fully dollars. New members ca|Julius Tran|3|pri|6|cally|730|Ash Hill|Boulevard|Suite 0|Fairview|Williamson County|TN|35709|United States|-5|0.11|
2|AAAAAAAACAAAAAAA|1998-01-01|2000-12-31||2450806|Mid Atlantic|medium|2274|859572|8AM-8AM|Felipe Perkins|2|A bit narrow forms matter animals. Consist|Largely blank years put substantially deaf, new others. Question|Julius Durham|5|anti|1|ought|984|Center Hill|Way|Suite 70|Fairview|Williamson County|TN|35709|United States|-5|0.12|
3|AAAAAAAACAAAAAAA|2001-01-01|||2450806|Mid Atlantic|medium|2274|1566786|8AM-4PM|Mark Hightower|2|Wrong troops shall work sometimes in a opti|Largely blank years put substantially deaf, new others. Question|Julius Durham|1|ought|2|able|984|Center Hill|Way|Suite 70|Fairview|Williamson County|TN|35709|United States|-5|0.01|
4|AAAAAAAAEAAAAAAA|1998-01-01|2000-01-01||2451063|North Midwest|medium|1737|1127313|8AM-4PM|Larry Mccray|2|Dealers make most historical, direct students|Rich groups catch longer other fears; future,|Matthew Clifton|4|ese|3|pri|463|Pine Ridge|RD|Suite U|Fairview|Williamson County|TN|35709|United States|-5|0.05|
5|AAAAAAAAEAAAAAAA|2000-01-02|2001-12-31||2451063|North Midwest|small|1298|343970|8AM-8AM|Larry Mccray|2|Dealers make most historical, direct students|Blue, due beds come. Politicians would not make far thoughts. Specifically new horses partic|Gary Colburn|4|ese|3|pri|463|Pine Ridge|RD|Suite U|Fairview|Williamson County|TN|35709|United States|-5|0.12|
6|AAAAAAAAEAAAAAAA|2002-01-01|||2451063|North Midwest|medium|2618|1314236|8AM-4PM|Larry Mccray|5|Silly particles could pro|Blue, due beds come. Politicians would not make far thoughts. Specifically new horses partic|Gary Colburn|5|anti|3|pri|463|Pine Ridge|RD|Suite U|Fairview|Williamson County|TN|35709|United States|-5|0.11|
